[I 2026-05-01 01:58:47,292] A new study created in memory with name: no-name-06697c0e-6eff-483e-93df-c590ca23cbf9
Best trial: 23. Best value: 0.831899:  93%
 28/30 [4:18:38<20:21, 610.89s/it]
[I 2026-05-01 02:06:54,011] Trial 0 finished with value: 0.8100166359573601 and parameters: {'n_estimators': 500, 'learning_rate': 0.3984727409321965, 'max_depth': 12, 'max_leaves': 160, 'grow_policy': 'depthwise', 'subsample': 0.5, 'colsample_bytree': 1.0, 'colsample_bynode': 0.8, 'min_child_weight': 0.679657809075816, 'max_delta_step': 0, 'reg_alpha': 7.072114131472227, 'reg_lambda': 2.1368329072358767, 'scale_pos_weight': 0.8152843673110735}. Best is trial 0 with value: 0.8100166359573601.
Trial 0 finished with value=0.8100166359573601
[I 2026-05-01 02:12:15,197] Trial 1 finished with value: 0.7156435299242355 and parameters: {'n_estimators': 250, 'learning_rate': 0.011635338541918906, 'max_depth': 4, 'max_leaves': 160, 'grow_policy': 'depthwise', 'subsample': 0.8, 'colsample_bytree': 0.5, 'colsample_bynode': 0.6, 'min_child_weight': 0.029204338471814112, 'max_delta_step': 5, 'reg_alpha': 0.8431013932082461, 'reg_lambda': 0.006290644294586149, 'scale_pos_weight': 1.6338208828908807}. Best is trial 0 with value: 0.8100166359573601.
Trial 1 finished with value=0.7156435299242355
[I 2026-05-01 02:20:59,395] Trial 2 finished with value: 0.7682180119391274 and parameters: {'n_estimators': 750, 'learning_rate': 0.006192568649430466, 'max_depth': 10, 'max_leaves': 64, 'grow_policy': 'lossguide', 'subsample': 1.0, 'colsample_bytree': 0.9, 'colsample_bynode': 0.6, 'min_child_weight': 0.002458603276328005, 'max_delta_step': 7, 'reg_alpha': 0.015876781526923997, 'reg_lambda': 0.003077180271250686, 'scale_pos_weight': 1.563676518390185}. Best is trial 0 with value: 0.8100166359573601.
Trial 2 finished with value=0.7682180119391274
[I 2026-05-01 02:26:10,625] Trial 3 finished with value: 0.7550352276298798 and parameters: {'n_estimators': 250, 'learning_rate': 0.3293144658791554, 'max_depth': 4, 'max_leaves': 192, 'grow_policy': 'lossguide', 'subsample': 0.8, 'colsample_bytree': 0.6, 'colsample_bynode': 1.0, 'min_child_weight': 1.2604664585649468, 'max_delta_step': 10, 'reg_alpha': 2.9794544625913595, 'reg_lambda': 0.24637685958997463, 'scale_pos_weight': 4.176805377655878}. Best is trial 0 with value: 0.8100166359573601.
Trial 3 finished with value=0.7550352276298798
[I 2026-05-01 02:31:51,350] Trial 4 finished with value: 0.7346403502561824 and parameters: {'n_estimators': 250, 'learning_rate': 0.01232922360724369, 'max_depth': 0, 'max_leaves': 96, 'grow_policy': 'depthwise', 'subsample': 0.9, 'colsample_bytree': 0.7, 'colsample_bynode': 0.6, 'min_child_weight': 0.14817820606039092, 'max_delta_step': 1, 'reg_alpha': 1.025616274847307, 'reg_lambda': 0.0019870215385428634, 'scale_pos_weight': 4.851286697060361}. Best is trial 0 with value: 0.8100166359573601.
Trial 4 finished with value=0.7346403502561824
[I 2026-05-01 02:45:50,540] Trial 5 finished with value: 0.8190201918706599 and parameters: {'n_estimators': 1000, 'learning_rate': 0.012485368572526356, 'max_depth': 0, 'max_leaves': 224, 'grow_policy': 'lossguide', 'subsample': 0.9, 'colsample_bytree': 0.5, 'colsample_bynode': 0.7, 'min_child_weight': 0.0029072088906598446, 'max_delta_step': 9, 'reg_alpha': 0.13076473382928538, 'reg_lambda': 0.021066486017042207, 'scale_pos_weight': 0.5787997763336384}. Best is trial 5 with value: 0.8190201918706599.
Trial 5 finished with value=0.8190201918706599
[I 2026-05-01 02:53:11,810] Trial 6 finished with value: 0.804433629978023 and parameters: {'n_estimators': 500, 'learning_rate': 0.022353042733892443, 'max_depth': 12, 'max_leaves': 192, 'grow_policy': 'depthwise', 'subsample': 0.5, 'colsample_bytree': 0.9, 'colsample_bynode': 0.9, 'min_child_weight': 0.17583640270008521, 'max_delta_step': 8, 'reg_alpha': 0.02944272359149678, 'reg_lambda': 0.12329098365270515, 'scale_pos_weight': 1.3381691783830378}. Best is trial 5 with value: 0.8190201918706599.
Trial 6 finished with value=0.804433629978023
[I 2026-05-01 02:59:41,739] Trial 7 finished with value: 0.7690570273339264 and parameters: {'n_estimators': 250, 'learning_rate': 0.008217748737555666, 'max_depth': 0, 'max_leaves': 192, 'grow_policy': 'lossguide', 'subsample': 1.0, 'colsample_bytree': 0.6, 'colsample_bynode': 0.7, 'min_child_weight': 1.0524574681335637, 'max_delta_step': 2, 'reg_alpha': 0.00024260488932164486, 'reg_lambda': 0.014421346497969485, 'scale_pos_weight': 0.7247551191627339}. Best is trial 5 with value: 0.8190201918706599.
Trial 7 finished with value=0.7690570273339264
[I 2026-05-01 03:09:41,805] Trial 8 finished with value: 0.8312245506105186 and parameters: {'n_estimators': 1000, 'learning_rate': 0.2066382729733181, 'max_depth': 10, 'max_leaves': 224, 'grow_policy': 'depthwise', 'subsample': 1.0, 'colsample_bytree': 0.8, 'colsample_bynode': 0.9, 'min_child_weight': 3.840300419098857, 'max_delta_step': 3, 'reg_alpha': 0.000355025561231308, 'reg_lambda': 0.008160948743089917, 'scale_pos_weight': 1.3368349555492052}. Best is trial 8 with value: 0.8312245506105186.
Trial 8 finished with value=0.8312245506105186
[I 2026-05-01 03:19:28,742] Trial 9 finished with value: 0.7942849480698756 and parameters: {'n_estimators': 1000, 'learning_rate': 0.26328806385787124, 'max_depth': 0, 'max_leaves': 160, 'grow_policy': 'depthwise', 'subsample': 0.5, 'colsample_bytree': 0.7, 'colsample_bynode': 1.0, 'min_child_weight': 0.019625093208439862, 'max_delta_step': 5, 'reg_alpha': 0.3274121520988885, 'reg_lambda': 0.02847858516856297, 'scale_pos_weight': 4.685458407799062}. Best is trial 8 with value: 0.8312245506105186.
Trial 9 finished with value=0.7942849480698756
[I 2026-05-01 03:29:48,715] Trial 10 finished with value: 0.8211212023546777 and parameters: {'n_estimators': 750, 'learning_rate': 0.11831880268365708, 'max_depth': 16, 'max_leaves': 256, 'grow_policy': 'depthwise', 'subsample': 0.7, 'colsample_bytree': 0.8, 'colsample_bynode': 0.9, 'min_child_weight': 7.579616227230478, 'max_delta_step': 3, 'reg_alpha': 0.00013699609124372505, 'reg_lambda': 6.070701514183076, 'scale_pos_weight': 2.4513648835494877}. Best is trial 8 with value: 0.8312245506105186.
Trial 10 finished with value=0.8211212023546777
[I 2026-05-01 03:40:11,938] Trial 11 finished with value: 0.8237248913874273 and parameters: {'n_estimators': 750, 'learning_rate': 0.10277153272160228, 'max_depth': 16, 'max_leaves': 256, 'grow_policy': 'depthwise', 'subsample': 0.7, 'colsample_bytree': 0.8, 'colsample_bynode': 0.9, 'min_child_weight': 9.885032801486325, 'max_delta_step': 3, 'reg_alpha': 0.00016942090142683128, 'reg_lambda': 8.643311533979524, 'scale_pos_weight': 2.52156803903726}. Best is trial 8 with value: 0.8312245506105186.
Trial 11 finished with value=0.8237248913874273
[I 2026-05-01 03:52:20,903] Trial 12 finished with value: 0.8227386980717268 and parameters: {'n_estimators': 1000, 'learning_rate': 0.07612159246138928, 'max_depth': 16, 'max_leaves': 256, 'grow_policy': 'depthwise', 'subsample': 0.7, 'colsample_bytree': 0.8, 'colsample_bynode': 0.9, 'min_child_weight': 9.775359624460025, 'max_delta_step': 4, 'reg_alpha': 0.0023902783873697023, 'reg_lambda': 1.110291262606602, 'scale_pos_weight': 2.3921346059285242}. Best is trial 8 with value: 0.8312245506105186.
Trial 12 finished with value=0.8227386980717268
[I 2026-05-01 04:00:27,495] Trial 13 finished with value: 0.8123894763784035 and parameters: {'n_estimators': 750, 'learning_rate': 0.1557682812391888, 'max_depth': 8, 'max_leaves': 256, 'grow_policy': 'depthwise', 'subsample': 0.6, 'colsample_bytree': 0.9, 'colsample_bynode': 0.8, 'min_child_weight': 3.0870382776822853, 'max_delta_step': 3, 'reg_alpha': 0.0012668019591971032, 'reg_lambda': 0.7084164288957713, 'scale_pos_weight': 2.598278466487687}. Best is trial 8 with value: 0.8312245506105186.
Trial 13 finished with value=0.8123894763784035
[I 2026-05-01 04:11:44,429] Trial 14 finished with value: 0.8165983908152089 and parameters: {'n_estimators': 1000, 'learning_rate': 0.04065033013432208, 'max_depth': 14, 'max_leaves': 224, 'grow_policy': 'depthwise', 'subsample': 0.6, 'colsample_bytree': 0.8, 'colsample_bynode': 0.9, 'min_child_weight': 3.4760142168687147, 'max_delta_step': 6, 'reg_alpha': 0.0012322937347418335, 'reg_lambda': 8.410896299273487, 'scale_pos_weight': 0.95344303474098}. Best is trial 8 with value: 0.8312245506105186.
Trial 14 finished with value=0.8165983908152089
[I 2026-05-01 04:19:09,419] Trial 15 finished with value: 0.8109447335931842 and parameters: {'n_estimators': 750, 'learning_rate': 0.05069713576464247, 'max_depth': 8, 'max_leaves': 96, 'grow_policy': 'depthwise', 'subsample': 0.9, 'colsample_bytree': 1.0, 'colsample_bynode': 1.0, 'min_child_weight': 0.37579787226377376, 'max_delta_step': 2, 'reg_alpha': 0.006074630250833402, 'reg_lambda': 0.06496178986722134, 'scale_pos_weight': 3.2163480831292333}. Best is trial 8 with value: 0.8312245506105186.
Trial 15 finished with value=0.8109447335931842
[I 2026-05-01 04:25:20,327] Trial 16 finished with value: 0.8180855583244454 and parameters: {'n_estimators': 500, 'learning_rate': 0.14936505152823693, 'max_depth': 6, 'max_leaves': 224, 'grow_policy': 'depthwise', 'subsample': 0.7, 'colsample_bytree': 0.7, 'colsample_bynode': 0.8, 'min_child_weight': 2.505344056610375, 'max_delta_step': 0, 'reg_alpha': 0.0004131730417413813, 'reg_lambda': 0.3395772210250348, 'scale_pos_weight': 1.1415640216345706}. Best is trial 8 with value: 0.8312245506105186.
Trial 16 finished with value=0.8180855583244454
[I 2026-05-01 04:32:58,172] Trial 17 finished with value: 0.7900141304541308 and parameters: {'n_estimators': 1000, 'learning_rate': 0.19562706173470873, 'max_depth': 14, 'max_leaves': 32, 'grow_policy': 'depthwise', 'subsample': 0.8, 'colsample_bytree': 0.9, 'colsample_bynode': 0.5, 'min_child_weight': 0.04294804544666601, 'max_delta_step': 4, 'reg_alpha': 0.0001193783216049899, 'reg_lambda': 0.006904766501954816, 'scale_pos_weight': 1.9090734048741047}. Best is trial 8 with value: 0.8312245506105186.
Trial 17 finished with value=0.7900141304541308
[I 2026-05-01 04:41:51,148] Trial 18 finished with value: 0.8104261382089449 and parameters: {'n_estimators': 750, 'learning_rate': 0.0875882397263919, 'max_depth': 10, 'max_leaves': 128, 'grow_policy': 'lossguide', 'subsample': 0.6, 'colsample_bytree': 0.8, 'colsample_bynode': 0.9, 'min_child_weight': 9.298652867993024, 'max_delta_step': 2, 'reg_alpha': 0.005590327124798198, 'reg_lambda': 0.050699970737307996, 'scale_pos_weight': 3.253774579798413}. Best is trial 8 with value: 0.8312245506105186.
Trial 18 finished with value=0.8104261382089449
[I 2026-05-01 04:51:50,074] Trial 19 finished with value: 0.8067288104508736 and parameters: {'n_estimators': 1000, 'learning_rate': 0.4618563219406315, 'max_depth': 14, 'max_leaves': 224, 'grow_policy': 'depthwise', 'subsample': 1.0, 'colsample_bytree': 0.6, 'colsample_bynode': 1.0, 'min_child_weight': 0.009419764524068445, 'max_delta_step': 6, 'reg_alpha': 0.0004850434914033713, 'reg_lambda': 0.0011646115759127516, 'scale_pos_weight': 1.9757167844558021}. Best is trial 8 with value: 0.8312245506105186.
Trial 19 finished with value=0.8067288104508736
[I 2026-05-01 05:00:52,994] Trial 20 finished with value: 0.8183439623647223 and parameters: {'n_estimators': 750, 'learning_rate': 0.0358963616722343, 'max_depth': 10, 'max_leaves': 256, 'grow_policy': 'depthwise', 'subsample': 0.9, 'colsample_bytree': 0.7, 'colsample_bynode': 0.8, 'min_child_weight': 0.3637261081527019, 'max_delta_step': 4, 'reg_alpha': 0.09205314638599477, 'reg_lambda': 3.2224824035043143, 'scale_pos_weight': 1.075699526433944}. Best is trial 8 with value: 0.8312245506105186.
Trial 20 finished with value=0.8183439623647223
[I 2026-05-01 05:12:54,700] Trial 21 finished with value: 0.8243718866347506 and parameters: {'n_estimators': 1000, 'learning_rate': 0.0701862656481159, 'max_depth': 16, 'max_leaves': 256, 'grow_policy': 'depthwise', 'subsample': 0.7, 'colsample_bytree': 0.8, 'colsample_bynode': 0.9, 'min_child_weight': 8.05354889176955, 'max_delta_step': 4, 'reg_alpha': 0.001256745026154994, 'reg_lambda': 1.15724196122336, 'scale_pos_weight': 2.4143071754122065}. Best is trial 8 with value: 0.8312245506105186.
Trial 21 finished with value=0.8243718866347506
[I 2026-05-01 05:24:37,243] Trial 22 finished with value: 0.8220195548020904 and parameters: {'n_estimators': 1000, 'learning_rate': 0.08296843457517893, 'max_depth': 16, 'max_leaves': 256, 'grow_policy': 'depthwise', 'subsample': 0.7, 'colsample_bytree': 0.8, 'colsample_bynode': 0.9, 'min_child_weight': 3.40966852124665, 'max_delta_step': 3, 'reg_alpha': 0.0007094406412303639, 'reg_lambda': 2.0689951408415017, 'scale_pos_weight': 3.1864672841939607}. Best is trial 8 with value: 0.8312245506105186.
Trial 22 finished with value=0.8220195548020904
[I 2026-05-01 05:35:48,929] Trial 23 finished with value: 0.8318993490912864 and parameters: {'n_estimators': 1000, 'learning_rate': 0.23311249539682263, 'max_depth': 12, 'max_leaves': 224, 'grow_policy': 'depthwise', 'subsample': 0.6, 'colsample_bytree': 0.9, 'colsample_bynode': 0.8, 'min_child_weight': 1.7411743631601744, 'max_delta_step': 1, 'reg_alpha': 0.003062842356399175, 'reg_lambda': 0.6401822631340475, 'scale_pos_weight': 2.0635539379374293}. Best is trial 23 with value: 0.8318993490912864.
Trial 23 finished with value=0.8318993490912864
[I 2026-05-01 05:46:43,440] Trial 24 finished with value: 0.8219298485997389 and parameters: {'n_estimators': 1000, 'learning_rate': 0.24513980345584924, 'max_depth': 12, 'max_leaves': 192, 'grow_policy': 'depthwise', 'subsample': 0.6, 'colsample_bytree': 0.9, 'colsample_bynode': 0.7, 'min_child_weight': 1.987398931851591, 'max_delta_step': 1, 'reg_alpha': 0.0037288992674572217, 'reg_lambda': 0.5333647925523599, 'scale_pos_weight': 1.680766029856793}. Best is trial 23 with value: 0.8318993490912864.
Trial 24 finished with value=0.8219298485997389
[I 2026-05-01 05:57:08,424] Trial 25 finished with value: 0.8118419959254486 and parameters: {'n_estimators': 1000, 'learning_rate': 0.05914736216808617, 'max_depth': 12, 'max_leaves': 224, 'grow_policy': 'depthwise', 'subsample': 0.6, 'colsample_bytree': 1.0, 'colsample_bynode': 0.8, 'min_child_weight': 0.45172189521104594, 'max_delta_step': 1, 'reg_alpha': 0.011977755158386649, 'reg_lambda': 0.19250087956286005, 'scale_pos_weight': 1.3585177533711748}. Best is trial 23 with value: 0.8318993490912864.
Trial 25 finished with value=0.8118419959254486
[I 2026-05-01 06:09:32,609] Trial 26 finished with value: 0.8228022948657276 and parameters: {'n_estimators': 1000, 'learning_rate': 0.19331882854555993, 'max_depth': 14, 'max_leaves': 224, 'grow_policy': 'lossguide', 'subsample': 0.8, 'colsample_bytree': 0.9, 'colsample_bynode': 0.8, 'min_child_weight': 4.937559541741793, 'max_delta_step': 5, 'reg_alpha': 0.0016462771157750645, 'reg_lambda': 0.8886049124780765, 'scale_pos_weight': 2.099881406581733}. Best is trial 23 with value: 0.8318993490912864.
Trial 26 finished with value=0.8228022948657276
[I 2026-05-01 06:17:26,059] Trial 27 finished with value: 0.8074503346972411 and parameters: {'n_estimators': 1000, 'learning_rate': 0.028192437514724212, 'max_depth': 6, 'max_leaves': 192, 'grow_policy': 'depthwise', 'subsample': 0.6, 'colsample_bytree': 1.0, 'colsample_bynode': 1.0, 'min_child_weight': 1.1739806261228718, 'max_delta_step': 2, 'reg_alpha': 0.0007701205744392363, 'reg_lambda': 0.1350193202598871, 'scale_pos_weight': 1.3851147420731575}. Best is trial 23 with value: 0.8318993490912864.
Trial 27 finished with value=0.8074503346972411